subtitle_filename,label_counts,avg_confidences,weighted_vote,explanations
1977Star.Wars.Episode.IV.-.A.New.Hope,{'clear': 12},{'clear': 0.95},clear,"['clear (0.95): The film establishes a strong moral binary with the Rebel Alliance and characters like Luke Skywalker and Obi-Wan Kenobi representing righteousness and justice, while the Galactic Empire, led by Darth Vader and Grand Moff Tarkin, embodies corruption and villainy through their destructive actions and pursuit of power.', 'clear (0.95): The film establishes a strong moral binary, with the Rebel Alliance and Jedi representing righteousness and fighting for freedom, while the Galactic Empire and Darth Vader embody corruption and tyranny through their destructive actions and explicit dark side affiliations.', 'clear (0.95): The film establishes a strong moral binary, with the Rebel Alliance portrayed as righteous heroes fighting for freedom and justice, while the Galactic Empire, led by Darth Vader and Grand Moff Tarkin, is depicted as corrupt and villainous for its destructive actions and tyranny.', 'clear (0.95): The film portrays a strong moral binary where the Rebel Alliance and Jedi represent righteousness and freedom, fighting against the corrupt and villainous Galactic Empire led by Darth Vader and Grand Moff Tarkin, who use destruction and tyranny to maintain power.', 'clear (0.95): The film presents a stark moral binary, with the Rebel Alliance and characters like Luke Skywalker and Obi-Wan Kenobi depicted as righteous heroes fighting for freedom and justice, while the Galactic Empire, led by Darth Vader and Grand Moff Tarkin, is portrayed as unequivocally villainous through their acts of destruction and tyranny.', 'clear (0.95): The film presents a strong moral binary where the Rebel Alliance and Jedi, representing justice, freedom, and the light side of the Force, are clearly opposed to the Galactic Empire and its leaders like Darth Vader, who embody tyranny, destruction, and evil.', 'clear (0.95): The film establishes a strong moral binary with the Rebel Alliance and Jedi as righteous heroes fighting against the corrupt and destructive Galactic Empire, led by clear villains like Darth Vader and Grand Moff Tarkin, leaving little room for ambiguity in the central conflict.', 'clear (0.95): The film presents a strong moral binary, with the Rebel Alliance and its heroes like Luke Skywalker and Obi-Wan Kenobi as righteous fighters against the corrupt and destructive Galactic Empire led by Darth Vader, leaving little room for ambiguity in their roles.', 'clear (0.95): The film presents a stark moral binary between the heroic Rebel Alliance, who fight for freedom and justice, and the tyrannical Galactic Empire, led by villains like Darth Vader and Grand Moff Tarkin, making good and evil easily distinguishable.', ""clear (0.95): The film establishes a strong moral binary with the Rebel Alliance and Jedi as righteous heroes fighting against the corrupt and villainous Galactic Empire, exemplified by Darth Vader's tyranny and the Death Star's destruction."", 'clear (0.95): The film presents a strong moral binary where the Rebel Alliance and Jedi figures like Obi-Wan Kenobi represent good through their fight for freedom and justice, while the Galactic Empire and Darth Vader embody evil as tyrannical oppressors who destroy planets and pursue power at any cost.', ""clear (0.95): The film presents a stark moral binary between the heroic Rebel Alliance, who fight for freedom and justice, and the villainous Galactic Empire, which uses tyranny and destruction, as explicitly shown through character actions and dialogue labeling Vader as 'evil' and the Empire as oppressive.""]"
1984Ghostbusters,{'clear': 10},{'clear': 0.9},clear,"['clear (0.90): The film portrays a strong moral binary where the Ghostbusters are depicted as righteous heroes fighting against clearly villainous supernatural forces like Gozer and its minions, with no significant ambiguity in their motivations or the threat they face.', 'clear (0.90): The film portrays the Ghostbusters as unambiguous heroes fighting against clearly evil supernatural entities like Gozer and the ghosts, establishing a strong moral binary where good triumphs over villainous forces.', 'clear (0.90): The film portrays the Ghostbusters as clear heroes protecting the city from destructive supernatural entities like Gozer, establishing a strong moral binary where the protagonists are righteous and the antagonists are unambiguously villainous, with no significant moral ambiguity in their conflict.', 'clear (0.90): The film portrays a strong moral binary where the Ghostbusters are depicted as righteous heroes protecting the city from clearly villainous supernatural entities like Gozer and the ghosts, which cause destruction and chaos.', 'clear (0.90): The film portrays the Ghostbusters as heroic protagonists fighting against unambiguously evil supernatural forces like ghosts and Gozer, who threaten destruction, establishing a strong moral binary with the heroes as righteous and the antagonists as corrupt.', 'clear (0.90): The film portrays the Ghostbusters as unambiguous heroes fighting against destructive supernatural entities like Gozer and its minions, establishing a strong moral binary where the protagonists are righteous and the antagonists are clearly villainous. Although the tone is comedic, it does not introduce significant moral ambiguity.', 'clear (0.90): The film portrays a strong moral binary where the Ghostbusters are heroic figures fighting against clearly villainous supernatural forces like Gozer and its minions, with no significant moral ambiguity in the central conflict.', 'clear (0.90): The film portrays the Ghostbusters as unambiguous heroes fighting against villainous supernatural entities like ghosts and Gozer, who threaten destruction, creating a strong moral binary with the heroes as righteous protectors.', 'clear (0.90): The film portrays the Ghostbusters as heroic protagonists fighting against clearly evil supernatural entities like Gozer and the ghosts, with a strong moral binary where the heroes protect humanity from destruction. There is little ambiguity, as the villains are depicted as corrupt forces intent on apocalypse, while the Ghostbusters are unambiguously righteous.', 'clear (0.90): The film portrays a strong moral binary where the Ghostbusters are depicted as righteous heroes protecting the city from destructive supernatural entities like Gozer and the ghosts, with evil clearly embodied in these villainous forces.']"
2021Dont.Look.Up,{'complicated': 17},{'complicated': 0.903},complicated,"['complicated (0.90): The film blurs the lines between good and evil by depicting characters like the scientists as well-intentioned but flawed, while government and corporate figures prioritize self-interest over global survival, creating moral ambiguity rather than a clear binary.', 'complicated (0.90): The film blurs the lines between good and evil by depicting characters with mixed motives, such as scientists who act heroically but falter personally, and leaders who prioritize self-interest over global survival, emphasizing moral ambiguity in the face of catastrophe.', 'complicated (0.90): The film blurs the lines between good and evil by depicting characters like the scientists as flawed and the government officials as self-serving rather than purely villainous, emphasizing moral ambiguity in the context of human denial and greed amid a global threat.', 'complicated (0.95): The film blurs moral lines by depicting characters like government officials and scientists as driven by self-interest, apathy, and systemic flaws rather than clear-cut righteousness or villainy, emphasizing human greed and denial over a stark good vs. evil binary.', ""complicated (0.90): The film portrays moral ambiguity through characters like Dr. Mindy, who shifts from advocating for survival to personal gain, and institutions driven by greed over humanity's welfare, making it hard to distinctly label good or evil forces."", 'complicated (0.90): The film portrays moral ambiguity through characters like the protagonists who start with good intentions but falter due to personal flaws and systemic pressures, while antagonists are driven by self-interest rather than pure evil, blurring the lines between right and wrong in a satirical critique of society.', 'complicated (0.90): The film blurs the line between good and evil by depicting characters like the scientists as well-intentioned but flawed, while antagonists like the president and billionaire are driven by self-interest rather than pure villainy, emphasizing moral ambiguity in a satirical critique of societal denial and greed.', 'complicated (0.90): The film blurs the lines between good and evil by depicting characters like the scientists as flawed and the government and corporations as self-serving rather than purely villainous, emphasizing moral ambiguity in human responses to crisis.', 'complicated (0.90): The film blurs the lines between good and evil by depicting characters like government officials and scientists as flawed individuals driven by self-interest, greed, and denial rather than clear moral binaries, emphasizing systemic corruption and human ambiguity in the face of catastrophe.', 'complicated (0.90): The film blurs the lines between good and evil by depicting characters with mixed motivations, such as scientists trying to save humanity facing systemic corruption and self-interest, making moral distinctions ambiguous rather than binary.', 'complicated (0.90): The film blurs the lines between good and evil by depicting characters like the scientists as well-intentioned but flawed, while the government and corporate figures are driven by greed and self-interest rather than outright villainy, emphasizing moral ambiguity in a satirical critique of society.', 'complicated (0.90): The film blurs the lines between good and evil by portraying scientists as well-intentioned but flawed protagonists against self-serving leaders and corporations, emphasizing moral ambiguity through societal apathy, denial, and personal failings rather than a clear moral binary.', 'complicated (0.90): The film blurs the line between good and evil by depicting characters like the scientists as flawed and sometimes complicit in the corruption, while antagonists like the president and billionaire are driven by greed within a system of apathy and denial, emphasizing moral ambiguity over a clear binary.', 'complicated (0.90): The film blurs the lines between good and evil by depicting scientists as flawed protagonists who sometimes compromise their principles, while antagonists like the President and billionaire are driven by self-interest rather than pure villainy, highlighting moral ambiguity in societal responses to crisis.', 'complicated (0.90): The film blurs the lines between good and evil by depicting characters like the government officials and scientists as flawed individuals driven by self-interest, denial, and incompetence rather than clear moral binaries, emphasizing societal failures over distinct heroes and villains.', 'complicated (0.90): The film blurs the lines between good and evil by showing characters with mixed motives, such as scientists who try to warn humanity but face personal flaws and societal apathy, while leaders prioritize self-interest over global survival, emphasizing moral ambiguity rather than a clear binary.', 'complicated (0.90): The film portrays moral ambiguity through characters like the scientists who start as heroes but make flawed decisions, and antagonists driven by self-interest rather than pure villainy, highlighting a divided society where good and evil are intertwined rather than distinctly separated.']"
2013The.Purge,{'complicated': 7},{'complicated': 0.9},complicated,"['complicated (0.90): The film blurs the lines between good and evil by portraying a society where the annual Purge normalizes violence as a means of social cleansing, forcing characters into moral dilemmas where protective actions can mirror the very atrocities they oppose.', ""complicated (0.90): The film blurs the lines between good and evil by depicting a society where the Purge legalizes violence against the vulnerable, and characters' well-intentioned actions, like offering refuge, lead to moral dilemmas and unintended harm, highlighting systemic ambiguity rather than a clear binary."", 'complicated (0.90): The Purge portrays a dystopian society where the annual legalization of crime blurs the lines between good and evil, as ordinary people participate in violent acts sanctioned by the state, making it difficult to classify characters or institutions as purely righteous or corrupt.', ""complicated (0.90): The film blurs the line between good and evil by depicting the Purge as a government-sanctioned event that society views as necessary for societal health, despite its inherent violence and moral dilemmas, making characters' actions and intentions ambiguous rather than clearly righteous or villainous."", 'complicated (0.90): The film blurs the line between good and evil by depicting a society where annual legalized violence like the Purge normalizes murder, forcing characters like the Sandin family into moral dilemmas where self-preservation conflicts with basic humanity.', 'complicated (0.90): The Purge portrays a dystopian society where the annual legalization of crime creates moral ambiguity, as characters navigate survival and personal vendettas without clear distinctions between righteous actions and villainy.', 'complicated (0.90): The Purge presents a society where the annual legalization of crime forces characters into moral dilemmas, blurring the lines between good and evil as they resort to violence for survival while questioning their own actions.']"
1982First.Blood,{'complicated': 7},{'complicated': 0.879},complicated,"[""complicated (0.90): The film blurs the lines between good and evil, as Rambo's violent actions stem from PTSD and provocation by the police, who are portrayed as flawed and aggressive rather than purely villainous, emphasizing moral ambiguity in the context of war trauma."", 'complicated (0.90): The film blurs the line between good and evil by portraying Rambo as a traumatized veteran whose violent actions are a response to provocation and PTSD, while the sheriff and deputies are not purely villainous but exhibit flawed judgment and abuse of power, highlighting moral ambiguity in the conflict.', 'complicated (0.85): The film blurs the line between good and evil by depicting Rambo as a sympathetic victim of police abuse who responds with extreme violence, while the authorities are flawed and provocative but not entirely villainous, highlighting moral ambiguity in the conflict.', 'complicated (0.85): The film blurs the line between good and evil by depicting Rambo as a traumatized veteran whose violent actions stem from PTSD and provocation, while the sheriff and deputies are flawed enforcers rather than outright villains, highlighting moral ambiguity in responses to trauma and authority.', 'complicated (0.90): The film blurs the lines between good and evil, as Rambo, a decorated veteran, is provoked into violence by abusive authorities, but his actions escalate the conflict, creating moral ambiguity around who is truly at fault.', 'complicated (0.90): The film blurs the lines between good and evil by depicting Rambo as a traumatized veteran whose violent actions stem from PTSD and mistreatment, while the sheriff and deputies are flawed authority figures rather than clear villains, highlighting moral ambiguity in themes of war and societal neglect.', ""complicated (0.85): The film blurs the lines between good and evil, as Rambo, a decorated war veteran, is provoked into violence by abusive authorities, while the sheriff's pursuit, though excessive, stems from his duty to maintain order, creating moral ambiguity around trauma, justice, and vengeance.""]"
