subtitle_filename,label_counts,avg_confidences,weighted_vote,explanations
2006Night.at.the.Museum,"{'clear': 9, 'complicated': 1}","{'clear': 0.861, 'complicated': 0.8}",clear,"[""clear (0.90): The film portrays a strong moral binary where Larry and the museum exhibits represent good, as they protect the museum and uphold its wonder, while the retiring guards are depicted as corrupt villains stealing for personal gain. There is little ambiguity, with good ultimately triumphing through Larry's actions."", 'clear (0.90): The film portrays a strong moral binary where Larry and the helpful museum exhibits represent good, fighting against the thieving guards who are clearly villainous in their selfish actions; there is little ambiguity, as the conflict centers on straightforward heroism versus corruption.', 'clear (0.90): The film portrays a strong moral binary with Larry as the righteous protagonist who protects the museum and learns responsibility, while the retiring guards are clearly villainous for their theft and deceit. Good ultimately triumphs through honesty and heroism, with little moral ambiguity in the conflicts.', 'clear (0.85): The film features a strong moral binary with Larry as the righteous protagonist who protects the museum and his family, while the retiring guards are depicted as corrupt villains stealing artifacts for personal gain. This clear distinction emphasizes traditional good triumphing over evil without significant moral ambiguity.', 'clear (0.85): The film portrays a strong moral binary with Larry as the righteous protagonist fighting against the thieving guards, who are clearly villainous in their greed and deception, while the exhibits generally support good outcomes.', 'clear (0.80): The film establishes a strong moral binary with Larry and the helpful exhibits, such as Theodore Roosevelt, representing good through their protective and responsible actions, while the thieving guards embody clear villainy by stealing artifacts for personal gain.', 'clear (0.80): The film depicts a strong moral binary where Larry and the helpful exhibits represent good, protecting the museum and family values, while the thieving guards embody selfish evil, with good ultimately prevailing without significant ambiguity.', 'clear (0.85): The film depicts a strong moral binary where Larry and the museum exhibits represent good through their efforts to protect the museum and promote positive values, while the retiring guards embody evil as they steal artifacts for personal gain, making the conflict straightforward and righteous.', 'clear (0.90): The film portrays a strong moral binary with Larry as the righteous protagonist fighting to protect the museum and his family, while the retiring guards are depicted as corrupt villains stealing for personal gain, emphasizing clear distinctions between good and evil.', 'complicated (0.80): The film blurs the lines between good and evil by portraying the antagonists as self-serving retirees rather than purely villainous figures, while the protagonist Larry resolves conflicts through humor and teamwork without emphasizing a strong moral binary.']"
1978Superman,{'clear': 11},{'clear': 0.918},clear,"['clear (0.95): The film presents a strong moral binary where Superman is depicted as a righteous hero saving innocent people and upholding justice, while Lex Luthor is a clearly villainous character plotting mass destruction for personal gain.', 'clear (0.95): The film portrays Superman as a heroic figure who selflessly helps others and upholds justice, while Lex Luthor is depicted as a scheming villain using deception and lethal means like Kryptonite, establishing a strong moral binary between righteousness and corruption.', ""clear (0.90): The plot summary centers on Superman, a classic superhero who embodies clear moral good and fights against evident villains, establishing a strong binary of righteousness versus corruption. Despite the incomplete dialogue, the character's archetype reinforces this straightforward depiction."", 'clear (0.95): The film presents a strong moral binary with Superman as the righteous hero who selflessly saves lives and upholds justice, while Lex Luthor is depicted as a corrupt and villainous antagonist driven by greed and destruction.', 'clear (0.90): The film portrays Superman as a righteous hero saving lives and upholding justice, while antagonists like Lex Luthor are depicted as corrupt and villainous, creating a strong moral binary between good and evil.', 'clear (0.90): The film portrays Superman as an unambiguous force for good, sent to Earth to guide and protect humanity, creating a strong moral binary where he represents righteousness against implied corruption or villainy in the world. There is no significant moral ambiguity in the provided dialogue, which emphasizes his heroic purpose without blurring lines between good and evil.', 'clear (0.90): The film portrays Superman as a righteous hero fighting for truth, justice, and the American way, clearly distinguishing him from antagonists like Lex Luthor, who are depicted as scheming and villainous, creating a strong moral binary.', ""clear (0.90): The film depicts Superman as a righteous hero guided by moral principles from his fathers, contrasting with implied evils like interplanetary wars, establishing a strong moral binary where good (Superman's purpose) is clearly distinguished from corrupt or villainous forces."", 'clear (0.90): The film portrays Superman as a righteous hero who stops criminals and promotes good deeds, while Lex Luthor is depicted as a corrupt villain planning a major crime, creating a strong moral binary between good and evil.', 'clear (0.90): The dialogue establishes a strong moral binary, with Jor-El and the Kryptonian Council representing righteousness, truth, and the preservation of life, while General Zod and his followers are depicted as corrupt villains driven by treason and tyranny.', 'clear (0.95): The film depicts Superman as a righteous hero who selflessly saves people and upholds justice, while antagonists like Lex Luthor are portrayed as corrupt and villainous schemers, establishing a strong moral binary between good and evil.']"
2017Paddington.2,{'clear': 12},{'clear': 0.904},clear,"['clear (0.95): The film portrays a strong moral binary where Paddington and the Browns represent clear goodness through their honesty and kindness, while Phoenix Buchanan embodies evil as a deceitful thief, making the conflict straightforward with good ultimately triumphing.', 'clear (0.90): The film presents a strong moral binary with Paddington and the Browns as righteous protagonists fighting against the corrupt and villainous Phoenix Buchanan, who is clearly depicted as the thief and antagonist, emphasizing justice and innocence prevailing.', 'clear (0.90): The film presents a strong moral binary where Paddington and the Browns embody goodness through their honesty and efforts to prove innocence, while Phoenix Buchanan is depicted as a clearly villainous and corrupt antagonist. This straightforward distinction leaves little room for moral ambiguity, emphasizing righteous heroes against an evident wrongdoer.', 'clear (0.90): The film portrays a strong moral binary with Paddington and the Brown family as unambiguously good, representing innocence and justice, while Phoenix Buchanan is clearly evil as a deceptive thief and antagonist.', 'clear (0.90): The film presents a strong moral binary where Paddington and the Brown family represent goodness and innocence, clearly opposing the villainous Phoenix Buchanan, who is depicted as a deceitful thief with no redeeming qualities.', 'clear (0.90): The film portrays Paddington and the Browns as unambiguously good characters who embody kindness and justice, while Phoenix Buchanan is depicted as a clear villain through his deceitful actions, creating a strong moral binary with no significant ambiguity.', ""clear (0.90): The film presents a strong moral binary where Paddington and the Browns represent goodness, honesty, and justice, while Phoenix Buchanan embodies evil through his deceitful and greedy actions. This clear distinction is evident in the plot's resolution, where the innocent are vindicated and the villain is punished."", 'clear (0.90): The film portrays a strong moral binary where Paddington and the Browns represent clear goodness through their honesty and kindness, while Phoenix Buchanan is depicted as an unambiguously villainous thief, with the story resolving in a triumph of good over evil.', 'clear (0.90): The film establishes a strong moral binary with Paddington and the Browns as unambiguously good, innocent characters who uphold justice, while Phoenix Buchanan is depicted as a clear villain through his deceitful actions and theft, allowing good to triumph without ambiguity.', 'clear (0.90): The film portrays a strong moral binary with Paddington and the Browns as clearly righteous and innocent protagonists, while Phoenix Buchanan is depicted as a corrupt and villainous antagonist, emphasizing traditional good versus evil themes with little ambiguity.', 'clear (0.90): The film presents a strong moral binary where Paddington and the Brown family represent clear goodness through their kindness and pursuit of justice, while Phoenix Buchanan is depicted as a unambiguously villainous thief motivated by greed. There is little moral ambiguity, as the narrative reinforces traditional values of righteousness prevailing over corruption.', 'clear (0.90): The film presents a strong moral binary where Paddington and the Browns embody goodness, innocence, and justice, while Phoenix Buchanan represents clear villainy through his theft and deception. Although some characters like the prisoners show redemption, the narrative ultimately distinguishes righteous actions from corrupt ones without significant ambiguity.']"
2019Joker,{'complicated': 9},{'complicated': 0.933},complicated,"[""complicated (0.95): The film blurs the lines between good and evil by portraying Arthur Fleck as a victim of societal neglect who becomes a violent agent of chaos, while institutions like Gotham's government and elite are shown as flawed and uncaring, creating moral ambiguity rather than a clear binary."", 'complicated (0.90): The film blurs the lines between good and evil by depicting Arthur Fleck as a product of societal neglect and personal trauma, making his violent actions ambiguous rather than purely villainous, while portraying institutions and figures like Thomas Wayne as flawed and unsympathetic.', ""complicated (0.95): The film blurs the lines between good and evil by depicting Arthur Fleck as a product of societal neglect and personal trauma, making his descent into violence morally ambiguous rather than purely villainous, while institutions like Gotham's elite are flawed but not outright corrupt. This moral ambiguity is central, as characters and events cannot be easily categorized into clear sides."", ""complicated (0.95): The film blurs the lines between good and evil by portraying Arthur Fleck as a product of societal neglect and mental illness, whose violent actions arise from personal trauma rather than clear villainy, while depicting institutions like Thomas Wayne's elite as flawed and indifferent, adding to the moral ambiguity."", 'complicated (0.90): The film blurs the lines between good and evil by depicting Arthur Fleck as a victim of societal neglect and personal abuse who commits violent acts, while authority figures like Thomas Wayne and the police are shown as flawed and indifferent, creating moral ambiguity throughout.', ""complicated (0.95): The film blurs the lines between good and evil by depicting Arthur as a product of societal neglect and personal trauma, whose violent actions stem from moral ambiguity rather than clear villainy, while institutions like Gotham's elite are portrayed as corrupt and uncaring. This creates a narrative where characters cannot be easily classified as wholly good or evil, emphasizing the complexity of human behavior and societal influences."", ""complicated (0.90): The film portrays Arthur Fleck's descent into chaos as a result of societal neglect and personal trauma, blurring the lines between good and evil by showing him as both a victim and a perpetrator, while depicting institutions like the government and media as flawed and complicit. This moral ambiguity is central, making it impossible to neatly categorize characters or forces as purely righteous or villainous."", 'complicated (0.95): The film blurs the line between good and evil by depicting Arthur Fleck as a product of societal neglect and personal trauma, while portraying institutions and characters like Thomas Wayne as flawed and complicit, rather than clearly villainous.', 'complicated (0.95): The film blurs the lines between good and evil by depicting Arthur Fleck as a product of societal neglect and mental illness, making his actions ambiguous rather than purely villainous, while portraying institutions and society as flawed and complicit in his descent.']"
2005V.for.Vendetta,{'complicated': 16},{'complicated': 0.903},complicated,"[""complicated (0.90): The film portrays the Norsefire regime as clearly villainous through their oppressive actions, but V's violent methods and moral gray areas, such as his use of torture and manipulation, blur the distinction between good and evil, highlighting themes of moral ambiguity."", ""complicated (0.90): The film blurs the lines between good and evil by depicting V as a vigilante whose violent methods and moral manipulations, such as torturing Evey, mirror the regime's brutality, while the oppressive Norsefire government is shown as a product of societal fear and corruption."", ""complicated (0.90): The film portrays good and evil with significant moral ambiguity, as V's violent actions against the tyrannical Norsefire regime blur the lines between heroism and villainy, while characters like Evey grapple with the ethics of rebellion. This central theme of moral grayness prevents a clear distinction between righteous and corrupt forces."", ""complicated (0.90): The film portrays the Norsefire regime as a clear embodiment of evil through its fascist oppression and atrocities, but V's violent vigilante actions and moral manipulations, such as faking Evey's imprisonment, blur the lines between heroism and villainy, emphasizing moral ambiguity over a simple binary."", ""complicated (0.90): The film portrays a blurred line between good and evil, as V's violent vigilante actions against the oppressive Norsefire regime involve morally ambiguous tactics like torture and terrorism, making it unclear whether his methods justify the ends."", 'complicated (0.95): The film blurs the line between good and evil by depicting V as a heroic vigilante who uses violent and ethically questionable methods, such as torture and bombings, to combat a tyrannical regime, emphasizing moral ambiguity in the fight for justice.', ""complicated (0.90): The film portrays good and evil with significant moral ambiguity, as V's heroic resistance against the fascist regime involves violent and manipulative tactics that question his own righteousness, while characters like Evey and Finch evolve in ways that blur clear moral lines."", ""complicated (0.90): The film blurs the line between good and evil by depicting V as a heroic vigilante who uses violent and manipulative tactics, while the Norsefire regime is overtly tyrannical, creating moral ambiguity in the characters' actions and motivations. This ambiguity is central to the story, as it questions the ethics of rebellion and governance without clearly distinguishing righteous heroes from corrupt villains."", 'complicated (0.90): The film blurs the line between good and evil by depicting V as a heroic vigilante who uses violent and manipulative tactics, while the Norsefire regime is tyrannical but also reveals personal regrets and complexities in characters like Delia Surridge, emphasizing moral ambiguity over a clear binary.', ""complicated (0.90): The film portrays the conflict between V's rebellion and the Norsefire regime with moral ambiguity, as V's violent and manipulative methods, such as torturing Evey, mirror the regime's brutality, making it hard to classify characters as purely good or evil."", ""complicated (0.90): The film blurs the lines between good and evil, as V's violent and deceptive actions against the tyrannical Norsefire regime raise moral questions about justice and extremism, making characters like V and Evey morally ambiguous rather than clearly righteous or villainous."", ""complicated (0.90): The film portrays the Norsefire regime as clearly evil through their oppressive and tyrannical actions, but V's own violent methods, including psychological torture and manipulation, introduce moral ambiguity, making it difficult to classify characters as purely good or evil."", ""complicated (0.90): The film blurs the line between good and evil by depicting V as a heroic vigilante whose violent and manipulative methods mirror the regime's brutality, while also showing moral complexity in characters like Inspector Finch, emphasizing themes of ambiguity rather than a clear binary."", ""complicated (0.90): The film portrays good and evil with significant moral ambiguity, as V's violent vigilante actions against the tyrannical regime blur the lines between heroism and terrorism, while characters like Delia Surridge show remorse for their roles in atrocities."", ""complicated (0.90): The film blurs the lines between good and evil, as V's violent and manipulative actions against the tyrannical Norsefire regime raise moral questions about justice and revenge, making it difficult to classify characters as purely righteous or villainous."", 'complicated (0.90): The film blurs the line between good and evil by depicting V as a vigilante with justified grievances but extreme methods like violence and manipulation, while the Norsefire regime is tyrannical yet includes characters with personal remorse, emphasizing moral ambiguity over a clear binary.']"
2009Avatar,{'clear': 11},{'clear': 0.9},clear,"[""clear (0.90): The film portrays a strong moral binary where the Na'vi and their connection to nature represent good, while the human corporation's greed and exploitation embody evil, with little ambiguity in the central conflict despite Jake's personal journey."", ""clear (0.90): In Avatar, the Na'vi and their harmonious connection to nature are depicted as righteous and good, while the human corporation and its exploitative actions represent clear evil, creating a strong moral binary centered on environmental protection versus greed."", ""clear (0.90): The film presents a strong moral binary, with the Na'vi and Jake's eventual alliance as righteous defenders of their world against the corrupt corporation and military forces exploiting Pandora for profit."", ""clear (0.90): The film presents a strong moral binary where the Na'vi are depicted as righteous protectors of their sacred environment and culture, while the human corporation and military are portrayed as villainous exploiters driven by greed and destruction."", ""clear (0.90): The film portrays a strong moral binary where the Na'vi and their harmonious connection to nature represent good, while the human corporation's exploitative and destructive actions for profit embody evil, as seen in the dialogue highlighting corporate greed and military aggression."", ""clear (0.90): The film portrays a strong moral binary, with the Na'vi and their harmonious connection to nature as righteous and good, contrasted against the exploitative human corporation and military as corrupt and villainous invaders."", ""clear (0.90): The dialogue depicts a strong moral binary, with the human military, led by Colonel Quaritch, as corrupt and villainous in their aggressive exploitation, contrasting sharply with the more righteous and harmonious elements like the Na'vi and sympathetic characters."", ""clear (0.90): The dialogue portrays a strong moral binary, with the human forces led by Quaritch as corrupt and villainous invaders, contrasted against the righteous Na'vi and Jake Sully's redemption, emphasizing protection of nature and community."", ""clear (0.90): In Avatar, the moral conflict is clearly defined with the Na'vi and their connection to nature representing good, while the human invaders, led by Colonel Quaritch, are portrayed as villainous for their destructive exploitation and aggression."", ""clear (0.90): The film portrays a strong moral binary, with the Na'vi and their harmonious connection to nature as clearly good, while the human corporation and military are depicted as villainous exploiters driven by greed and destruction."", ""clear (0.90): The film depicts a strong moral binary where the Na'vi and their harmonious connection to nature represent good, while the human invaders, driven by greed and destruction, embody evil, as seen in the dialogue's portrayal of conflict and rallying cries against the aggressors.""]"
2003Pirates.of.the.Caribbean.The.Curse.of.the.Black.Pearl,{'complicated': 10},{'complicated': 0.895},complicated,"['complicated (0.90): The film blurs the line between good and evil through characters like Jack Sparrow, who is a charming anti-hero with a personal code, and the British Navy, which enforces order but shows rigidity and self-interest, creating moral ambiguity rather than a clear binary.', 'complicated (0.90): The film blurs the lines between good and evil through characters like Jack Sparrow, who is a self-serving pirate yet aids the protagonists, and the British Navy, which represents order but shows rigidity and self-interest, creating moral ambiguity rather than a clear binary.', 'complicated (0.90): The film blurs the lines between good and evil through characters like Jack Sparrow, who is a self-serving anti-hero, and Barbossa, whose villainy stems from a curse rather than pure malice, making moral distinctions ambiguous rather than binary.', 'complicated (0.90): The film blurs the lines between good and evil by portraying Jack Sparrow as a charismatic anti-hero who engages in piracy yet performs heroic acts, while the British Navy, typically seen as lawful, exhibits rigidity and flaws that undermine their moral superiority.', 'complicated (0.90): The film blurs the lines between good and evil through characters like Jack Sparrow, who operates as an anti-hero with moral ambiguity, while villains like Barbossa are cursed and driven by desperation rather than pure malice, making clear moral distinctions difficult.', ""complicated (0.90): The film features clear villains in Barbossa and his cursed crew, but Jack Sparrow's character introduces moral ambiguity as a self-serving pirate who ultimately helps the protagonists, blurring the lines between good and evil."", 'complicated (0.85): The film features clear villains in Barbossa and his cursed crew, who embody greed and violence, but protagonists like Jack Sparrow introduce moral ambiguity through his self-interested actions and shifting alliances, blurring the lines between heroism and villainy.', ""complicated (0.90): The film portrays good and evil with significant moral ambiguity, as characters like Jack Sparrow embody both heroic and villainous traits, while the cursed pirates' motivations and the Navy's rigid self-interest blur traditional moral lines."", 'complicated (0.90): The film portrays characters like Jack Sparrow as morally ambiguous anti-heroes who blur the lines between good and evil through self-serving yet heroic actions, while villains like Barbossa have backstories and codes that add depth rather than pure villainy.', ""complicated (0.90): The film blurs the lines between good and evil through characters like Jack Sparrow, who is a self-serving pirate yet aids the protagonists, while the British Navy's rigid enforcement of law sometimes hinders justice, creating moral ambiguity central to the story.""]"
