subtitle_filename,label_counts,avg_confidences,weighted_vote,explanations
2012The.Hunger.Games,"{'clear': 7, 'complicated': 1}","{'clear': 0.893, 'complicated': 0.8}",clear,"['clear (0.85): The film depicts a strong moral binary between the oppressive Capitol, portrayed as corrupt and villainous for enforcing the brutal Hunger Games, and protagonists like Katniss who embody righteousness by fighting for survival and justice, making good and evil easily distinguishable.', 'clear (0.90): The film establishes a strong moral binary, with the oppressive Capitol and its Hunger Games representing clear evil, while protagonists like Katniss embody righteousness and resistance against injustice.', 'clear (0.90): The film portrays a strong moral binary with the oppressive Capitol and its Hunger Games as clear symbols of evil, while protagonists like Katniss represent good through their fight for survival, family, and justice against this tyranny.', 'complicated (0.80): The film portrays a primary conflict between the oppressive Capitol and the oppressed districts, suggesting a moral binary, but introduces ambiguity through characters like Katniss who must navigate survival-driven violence and alliances, blurring the lines between good and evil.', 'clear (0.90): The film portrays a strong moral binary, with the oppressive Capitol and its exploitative Hunger Games representing clear evil, while protagonists like Katniss embody righteousness and resistance against injustice.', 'clear (0.90): The film portrays a strong moral binary where the Capitol and its Hunger Games represent evil through oppression and exploitation, while Katniss and the districts embody good by fighting for survival and justice.', 'clear (0.90): The film establishes a strong moral binary with the oppressive Capitol and its deadly games representing clear evil, while protagonists like Katniss embody righteousness and resistance, making the conflict straightforward despite some character nuances.', 'clear (0.90): The film establishes a strong moral binary with the oppressive Capitol as the clear villainous force and Katniss and the districts as righteous protagonists fighting for survival and justice.']"
1985Back.To.The.Future,"{'neutral': 4, 'clear': 5, 'complicated': 2}","{'neutral': 0.8, 'clear': 0.83, 'complicated': 0.8}",clear,"['neutral (0.80): The film emphasizes adventure, time travel, and personal relationships over a moral binary, with conflicts like bullying and timeline alterations presented as situational challenges rather than a clear battle between righteous good and corrupt evil.', 'clear (0.80): The film presents a strong moral binary with protagonists like Marty and Doc as righteous heroes who combat clear villains such as Biff, the bully, and the Libyan terrorists, emphasizing themes of personal integrity and justice over corruption.', 'complicated (0.80): The film blurs the line between good and evil through characters like Biff, who is a bully but not a profound villain, and Marty, whose time-travel interventions create moral ambiguities in altering personal destinies, rather than presenting a clear righteous versus corrupt divide.', 'complicated (0.80): The film portrays Biff as a clear antagonist through his bullying and selfish actions, but the central conflicts involve personal relationships and unintended consequences of time travel, blurring moral lines as characters like Marty and Doc navigate gray areas rather than a straightforward battle of righteousness versus corruption.', 'clear (0.85): The film portrays a strong moral binary where Marty and Doc represent good through their heroic actions and efforts to improve lives, while Biff embodies evil as a bullying antagonist, with the story resolving in favor of the righteous side.', 'clear (0.90): The film presents a strong moral binary with protagonists like Marty and Doc as righteous heroes fighting against clear villains such as Biff, the bully, and the Libyan terrorists, emphasizing themes of personal integrity and justice.', ""neutral (0.80): The film primarily emphasizes adventure, time travel, and personal growth rather than a clear moral binary, with conflicts like Biff's bullying presented as comedic and interpersonal rather than deeply evil."", 'neutral (0.80): The film focuses on personal and familial conflicts, such as bullying and time-altering adventures, without framing them in a strong moral binary; Biff is an antagonist, but the story emphasizes humor and self-improvement over righteous good versus corrupt evil.', ""neutral (0.80): The film primarily focuses on themes of time travel, personal growth, and family dynamics rather than a pronounced moral battle between good and evil, with conflicts like Biff's bullying presented as everyday obstacles rather than deeply villainous acts."", 'clear (0.80): The film establishes a strong moral binary with characters like Biff as a clear villainous bully and protagonists like Marty and George as righteous figures who overcome adversity, emphasizing themes of heroism and redemption.', 'clear (0.80): The film presents a strong moral binary with characters like Marty and Doc as righteous heroes fighting against the corrupt and villainous Biff, who embodies bullying and negative influences, making good and evil distinctly separated. While there is some light-hearted ambiguity in character motivations, the overall narrative emphasizes a clear triumph of good through personal growth and correction of past wrongs.']"
2008The.Hurt.Locker,{'complicated': 9},{'complicated': 0.9},complicated,"['complicated (0.90): The film portrays the Iraq War with moral ambiguity, as U.S. soldiers like James exhibit reckless and flawed behavior that blurs their heroism, while insurgents are depicted as faceless threats rather than clear villains, highlighting the complexities of conflict and human nature.', ""complicated (0.85): The film portrays the Iraq War with moral ambiguity, as the soldiers' actions, such as James's reckless decisions and the team's internal conflicts, blur the lines between heroism and questionable ethics, while insurgents are depicted more as adversaries in a chaotic environment rather than clear villains."", 'complicated (0.90): The film portrays the Iraq War with moral ambiguity, as soldiers like James exhibit reckless behavior that blurs their heroism, while insurgents are depicted as human elements in a chaotic environment rather than clear villains, emphasizing personal trauma over a stark good-vs-evil binary.', ""complicated (0.90): The film blurs the lines between good and evil by focusing on the soldiers' internal conflicts, reckless actions, and moral ambiguities in a war zone, rather than presenting a clear righteous side against a villainous one."", 'complicated (0.90): The film blurs the lines between good and evil by depicting soldiers as flawed individuals navigating the moral complexities of war, where insurgents are not purely villainous and characters like James exhibit both bravery and recklessness, emphasizing ambiguity over a clear moral binary.', 'complicated (0.90): The film portrays the Iraq War through morally ambiguous characters and situations, such as soldiers making reckless decisions and facing internal conflicts, blurring the lines between good and evil rather than presenting a clear moral binary.', 'complicated (0.90): The film blurs the lines between good and evil by depicting U.S. soldiers as flawed individuals making risky decisions in a chaotic war environment, while insurgents are shown as faceless threats rather than clear villains, emphasizing moral ambiguity and the psychological toll of conflict.', 'complicated (0.90): The film blurs the lines between good and evil by depicting U.S. soldiers as flawed individuals making morally ambiguous decisions in war, while humanizing Iraqi characters and showing the futility of conflict, rather than presenting a clear moral binary.', ""complicated (0.95): The film blurs the lines between good and evil by focusing on the soldiers' personal struggles, moral dilemmas, and the futility of war, rather than presenting a clear dichotomy between righteous heroes and villainous foes.""]"
2006Blood.Diamond,{'complicated': 11},{'complicated': 0.891},complicated,"['complicated (0.90): The film blurs the lines between good and evil through characters like Danny Archer, who starts as a self-interested gunrunner but shows redemption, and by highlighting systemic corruption in the diamond trade, making moral distinctions ambiguous rather than absolute.', 'complicated (0.90): The film portrays a moral landscape where clear villains like the RUF and Captain Poison exist, but characters like Danny Archer embody ambiguity through their self-serving actions that eventually lead to heroic sacrifices, highlighting the blurred lines between good and evil in the context of war and the diamond trade.', 'complicated (0.85): The film blurs the lines between good and evil through characters like Danny Archer, who starts as a self-serving gunrunner but performs redemptive acts, highlighting moral ambiguity in the context of war and exploitation, while still featuring clear villains like the RUF.', 'complicated (0.90): The film portrays moral ambiguity through characters like Danny Archer, who starts as a self-serving smuggler but ultimately sacrifices for others, and the intertwined corruption in the diamond trade that implicates governments, rebels, and civilians alike.', 'complicated (0.90): The film blurs the lines between good and evil by portraying characters like Danny Archer as morally ambiguous opportunists who evolve but remain flawed, while also showing how global demand for diamonds implicates ordinary people in the conflict, rather than presenting a simple righteous versus villainous divide.', 'complicated (0.90): The film blurs the lines between good and evil through characters like Danny Archer, who starts as a self-serving gunrunner but shows redemption, and the systemic corruption in the diamond trade, making moral distinctions ambiguous rather than binary.', ""complicated (0.90): The film portrays characters with mixed motives, such as Danny Archer's self-interested actions that occasionally aid others, blurring the lines between good and evil in the context of war and the diamond trade."", 'complicated (0.90): The film blurs the lines between good and evil through characters like Danny Archer, who starts as a self-serving gunrunner but shows redemption, and by highlighting systemic corruption in the diamond trade involving both local warlords and international figures, making moral distinctions ambiguous.', 'complicated (0.90): The film portrays a moral landscape where clear villains like the RUF and Colonel Coetzee exist, but characters like Danny Archer embody ambiguity through their self-serving actions and eventual redemption, highlighting the blurred lines caused by war and exploitation.', 'complicated (0.85): The film blurs the lines between good and evil through characters like Danny Archer, who starts as a self-interested mercenary but ultimately sacrifices himself for a greater good, highlighting moral ambiguity in the context of war and exploitation, while still featuring clear villains like Captain Poison and Colonel Coetzee.', 'complicated (0.90): The film features clear villains like the RUF and Captain Poison, but characters such as Danny Archer embody moral ambiguity, starting as self-interested mercenaries and evolving through acts of redemption, blurring the lines between good and evil in the context of war and corruption.']"
1976Rocky.I,{'neutral': 13},{'neutral': 0.858},neutral,"[""neutral (0.85): The film's central conflict revolves around a boxing match as a personal challenge and underdog story, focusing on themes of perseverance and self-improvement rather than a moral battle between good and evil."", ""neutral (0.85): The film's central conflict revolves around a boxing match and personal growth, without framing it as a moral battle between righteous good and corrupt evil; characters like Rocky and Apollo are portrayed as flawed individuals focused on ambition and resilience rather than clear moral binaries."", 'neutral (0.85): The film focuses on personal struggles, training, and competition in boxing rather than framing the conflict as a moral battle between good and evil, with characters like Rocky and Apollo depicted as ordinary individuals pursuing their goals. While there is rivalry, it lacks a clear righteous versus corrupt dynamic, emphasizing themes of perseverance and underdog spirit instead.', 'neutral (0.80): The film focuses on personal struggles, athletic competition, and relationships rather than framing the conflict as a moral binary, with characters like Rocky showing flaws but not embodying clear good or evil archetypes.', 'neutral (0.80): The film emphasizes personal growth, determination, and the thrill of boxing rather than a clear moral binary, with characters like Rocky and Apollo portrayed as flawed but not inherently good or evil individuals.', ""neutral (0.85): The film's central conflict revolves around a boxing match and personal struggles, such as training and relationships, without framing it as a moral battle between righteous and villainous forces; characters like Rocky exhibit both flaws and virtues, emphasizing individual growth over clear good vs. evil dynamics."", ""neutral (0.85): The film's plot focuses on Rocky's personal journey, training, and boxing match as a test of endurance and self-improvement, rather than framing the conflict in strong moral terms between good and evil."", ""neutral (0.90): The film portrays the conflict as a personal and sporting challenge rather than a moral binary, focusing on Rocky's determination and relationships without depicting characters like Apollo Creed as inherently evil. While there are interpersonal tensions, such as with Paulie or Mickey, they stem from human flaws rather than a clear good vs evil framework."", 'neutral (0.90): The film focuses on personal struggle, competition, and character development in a boxing context, without framing the conflict as a moral battle between righteous good and villainous evil, emphasizing instead themes of determination and underdog spirit.', 'neutral (0.85): The film focuses on personal growth, competition, and relationships in the context of a boxing match, without framing the conflict as a moral battle between good and evil, as characters like Rocky and Apollo are portrayed as flawed but not inherently righteous or villainous.', 'neutral (0.90): The film focuses on a sporting competition and personal growth rather than a moral binary, with the conflict between Rocky and Apollo depicted as a fair challenge between athletes without clear righteous or villainous elements.', ""neutral (0.85): The film portrays the conflict as a personal and professional boxing challenge focused on individual growth and determination, rather than a stark moral binary between good and evil. While characters have flaws, such as Rocky's ties to a loan shark or Apollo's arrogance, these are not framed as profound moral corruption or righteousness."", ""neutral (0.90): The film portrays the conflict primarily as a personal and athletic challenge rather than a moral binary, focusing on Rocky's self-improvement and determination against Apollo Creed, who is more of a competitive opponent than a villainous force.""]"
2005The.Constant.Gardener,{'complicated': 13},{'complicated': 0.865},complicated,"['complicated (0.80): The film portrays a moral conflict where the protagonists fight against corrupt bureaucracy and pharmaceutical companies, but personal relationships, activism, and ambiguous character motivations blur the lines between good and evil, emphasizing systemic flaws over clear-cut villainy.', 'complicated (0.90): The film portrays a moral conflict where good characters like Justin seek justice against corrupt entities, but the involvement of ostensibly benevolent institutions in the conspiracy blurs the lines between right and wrong, emphasizing moral ambiguity.', ""complicated (0.85): The film portrays a moral conflict where protagonists like Tessa and Justin challenge corrupt pharmaceutical companies and officials, but the ambiguity in characters' motivations, such as Sandy's reluctant complicity, and the systemic nature of global bureaucracy blur the lines between good and evil."", 'complicated (0.85): The film portrays a moral ambiguity in its central conflict, where corrupt pharmaceutical companies and bureaucratic entities represent potential evil, but characters like the protagonist navigate gray areas of truth and alliances, making clear distinctions impossible.', 'complicated (0.90): The film portrays a web of corruption, personal betrayals, and moral dilemmas where characters like Sandy exhibit conflicting loyalties, blurring the lines between good and evil rather than presenting a clear moral binary.', 'complicated (0.80): The film presents a moral conflict where characters like Tessa challenge corruption and unethical pharmaceutical practices, but the ambiguity in diplomatic motivations and personal relationships blurs the lines between good and evil, making it hard to classify sides clearly.', 'complicated (0.85): The film portrays a moral conflict where characters like Justin uncover corporate and bureaucratic corruption, but personal motivations and institutional ambiguities blur the lines between good and evil, making it hard to classify sides as purely righteous or villainous.', 'complicated (0.90): The film portrays a web of corruption involving pharmaceutical companies and government officials who justify harmful actions for economic gains, while protagonists like Justin seek justice, creating moral ambiguity as even allies engage in betrayal and self-interest.', 'complicated (0.80): The film portrays a moral conflict where protagonists like Justin and Tessa challenge corrupt pharmaceutical companies and officials, but personal flaws, ethical dilemmas, and ambiguous motivations blur the lines between good and evil, making clear judgments difficult.', 'complicated (0.90): The film depicts a murky moral landscape where corporate greed and exploitation in Africa blur the lines between good and evil, as characters like pharmaceutical executives and activists are shown with mixed motivations and unintended consequences, rather than clear-cut heroism or villainy.', 'complicated (0.90): The film portrays a web of corruption involving pharmaceutical companies and governments, where protagonists like Justin and Tessa engage in morally ambiguous actions, blurring the lines between good and evil as they fight systemic injustice.', 'complicated (0.90): The film blurs the line between good and evil through its depiction of corrupt corporations and officials intertwined with well-intentioned characters whose actions lead to unintended harm, emphasizing moral ambiguity in global conspiracies and personal dilemmas.', 'complicated (0.90): The film portrays a moral conflict where corrupt governments and pharmaceutical companies exploit vulnerable populations for profit, blurring the lines between institutional evil and systemic complicity, as characters uncover layers of deception rather than a straightforward battle of righteousness versus villainy.']"
1981Indiana.Jones.And.The.Raiders.Of.The.Lost.Ark,{'clear': 6},{'clear': 0.933},clear,"[""clear (0.95): The film presents a strong moral binary with Indiana Jones and his allies as righteous heroes combating the villainous Nazis, who are depicted as corrupt and power-hungry in their quest for the Ark. Good and evil are distinctly separated, with no significant moral ambiguity in the characters' motivations or actions."", ""clear (0.90): The film portrays a strong moral binary with Indiana Jones and his allies as righteous heroes fighting against the villainous Nazis, who are depicted as corrupt and power-hungry in their pursuit of the Ark of the Covenant, emphasizing a clear good vs. evil dynamic despite minor character ambiguities like Belloq's similarities to Jones."", 'clear (0.95): The film presents a strong moral binary where Indiana Jones and his allies are depicted as righteous heroes fighting to prevent the villainous Nazis from obtaining the Ark of the Covenant, which is portrayed as a powerful force against evil.', 'clear (0.90): The film presents a strong moral binary with Indiana Jones and his allies as righteous heroes fighting against the villainous Nazis, who are depicted as corrupt and power-hungry, seeking the Ark for evil domination. While there is slight ambiguity in the character of Belloq, who shares similarities with Jones, the overall narrative emphasizes a clear distinction between good and evil.', 'clear (0.95): The film portrays a strong moral binary with Indiana Jones and his allies as righteous heroes fighting against the villainous Nazis, who are depicted as corrupt and power-hungry in their pursuit of the Ark of the Covenant.', 'clear (0.95): The film presents a strong moral binary where Indiana Jones and his allies embody righteousness in their efforts to protect the Ark from the Nazis, who are depicted as corrupt and villainous pursuers of power, leaving little room for ambiguity.']"
2018Black.Panther,{'complicated': 10},{'complicated': 0.9},complicated,"[""complicated (0.90): The film blurs the lines between good and evil through characters like Killmonger, whose violent quest for justice stems from legitimate grievances against oppression, making him a morally complex antagonist rather than a straightforward villain, while T'Challa's own nation's isolationist policies add ambiguity to what constitutes 'good'."", ""complicated (0.90): The film blurs the lines between good and evil by portraying Killmonger as a sympathetic figure driven by legitimate grievances against oppression, while T'Challa's moral stance evolves from isolationism to outreach, emphasizing themes of ambiguity and shared humanity."", ""complicated (0.90): The film blurs the lines between good and evil by portraying Killmonger as a villain with legitimate grievances against Wakanda's isolationism, while heroes like T'Challa confront their own moral flaws, such as abandoning his cousin, making it hard to classify characters as purely righteous or corrupt."", ""complicated (0.90): The film blurs the lines between good and evil by portraying Killmonger as a villain with valid motivations rooted in historical oppression, while T'Challa's own moral evolution highlights the complexities of isolationism and intervention."", ""complicated (0.90): The film blurs the line between good and evil through characters like Killmonger, whose motivations for challenging Wakanda's isolationism stem from historical injustices, making him a sympathetic antagonist, while T'Challa's journey involves questioning his own nation's moral choices."", ""complicated (0.90): The film blurs the lines between good and evil by portraying Killmonger's violent quest for justice as stemming from legitimate grievances against oppression, while T'Challa's protective isolationism is challenged as potentially self-serving, creating moral ambiguity rather than a clear binary."", ""complicated (0.90): The film blurs the line between good and evil through characters like Killmonger, whose motivations for empowering oppressed people stem from legitimate grievances against systemic injustices, while T'Challa's heroic actions are complicated by Wakanda's history of isolationism and family betrayals."", ""complicated (0.90): The film blurs the lines between good and evil through characters like Killmonger, whose motivations for challenging Wakanda's isolationism stem from personal trauma and a desire to aid oppressed people, while T'Challa grapples with moral dilemmas about his nation's role in the world, creating significant ambiguity."", ""complicated (0.90): The film portrays moral ambiguity through characters like Killmonger, whose violent quest for justice against oppression stems from personal and historical grievances, while T'Challa's heroic actions are complicated by Wakanda's isolationist past and internal conflicts, making it hard to classify sides as purely good or evil."", ""complicated (0.90): The film blurs the lines between good and evil through characters like Killmonger, whose motivations for empowering oppressed people are understandable but executed through violent means, contrasting with T'Challa's initially isolationist heroism, highlighting moral ambiguity in themes of tradition, justice, and global responsibility.""]"
